EVENT_ID,CZ_NAME_STR,BEGIN_LOCATION,BEGIN_DATE,BEGIN_TIME,EVENT_TYPE,MAGNITUDE,TOR_F_SCALE,DEATHS_DIRECT,INJURIES_DIRECT,DAMAGE_PROPERTY_NUM,DAMAGE_CROPS_NUM,STATE_ABBR,CZ_TIMEZONE,MAGNITUDE_TYPE,EPISODE_ID,CZ_TYPE,CZ_FIPS,WFO,INJURIES_INDIRECT,DEATHS_INDIRECT,SOURCE,FLOOD_CAUSE,TOR_LENGTH,TOR_WIDTH,BEGIN_RANGE,BEGIN_AZIMUTH,END_RANGE,END_AZIMUTH,END_LOCATION,END_DATE,END_TIME,BEGIN_LAT,BEGIN_LON,END_LAT,END_LON,EVENT_NARRATIVE,EPISODE_NARRATIVE,ABSOLUTE_ROWNUMBER
5269139,SAN BERNARDINO CO.,APPLE VLY,09/03/2001,1530,Lightning, , ,1,1,0,0,CA,PST, ,1122896,C,71,SGX,0,0,NEWSPAPER, , , ,3,E,3,E,APPLE VLY,09/03/2001,1530, , , , ,"","Part of the remnants of Hurricane Flossie, moved across Southwest California over a three day period.On 09/01/01, thunderstorms formed over the mountains and deserts of San Diego and Riverside Counties. Many reported small hail ranging in diameter from a quarter inch to a half inch. On 9/2/01, thunderstorms formed over all the mountains. Rainfall of over 2 inches in one hour was observed. Flooding and mudslides across major roadways occurred between Barton Flats and Forest Falls, from Oak Glen south to Cherry Valley  and into the Banning Pass near Beaumont, and around Lake Cuyamaca. Frequent lightning was recorded, with lightning detection sensors indicating about 60 strikes per hour. Numerous small fires were started in the National Forests. A group of four hikers climbing Stonewall Peak in the San Diego County Mountains encountered lightning and heavy rain. Two of the hikers stopped short of the peak and took shelter. Two others continued on to the lookout area which is surrounded by a metal railing. The 53 year old man was struck in the head by lightning and died. The other, a 13 year old boy, was knocked unconscious but survived. Small hail was observed by many. A downdraft from a thunderstorm knocked a tree onto a house in Beaumont. On 9/3/01, afternoon thunderstorms formed over the San Bernardino Mountains and the Apple Valley. Two boys in an open field in Apple Valley were hit by lightning. The 13 year old was eating from a cup of noodles when lightning hit him in the head and exited his groin area. He was pronounced dead some time later after CPR efforts were unsuccessful. The 9 year old boy standing next to him was holding a metal tool  at the time. He "felt the lightning pick (him) up", and then awoke lying on the ground unable to feel his legs. He suffered burns to his right waist, left calf, left foot, and dehydration. Heavy downpours from the same thunderstorm caused street flooding as it moved further east.",80
5281723,SAN DIEGO CO.,(SAN)SAN DIEGO INTL,03/17/2002,2330,Lightning, , ,0,0,0,0,CA,PST, ,1131530,C,73,SGX,0,0,GENERAL PUBLIC, , , , , , , ,(SAN)SAN DIEGO INTL,03/17/2002,2330, , , , ,"","Border Patrol agents rescued five separate groups of people who were lightly clad and suffering from hypothermia in the San Diego Mountains near Pine Valley. Whiteout conditions were reported over the High Desert areas. The snow level was near 2500 feet. More than 12 inches of snow fell above 6000 level in less than 12 hours. Thunderstorms were present during the middle of the night. Lightning struck an aircraft on final approach into San Diego International Airport. Small hail was reported over the Apple Valley.",81
5290967,FRESNO CO.,FRESNO,05/20/2002,1230,Lightning, , ,0,0,0,0,CA,PST, ,1134420,C,19,HNX,0,0,TRAINED SPOTTER, , , ,10,N,10,N,FRESNO,05/20/2002,1230, , , , ,"Lightning strikes (2) in close proximity to overhead aircraft approaching Fresno Air Terminal.","",82
5290969,FRESNO CO.,FIG GARDEN,05/20/2002,1250,Lightning, , ,0,0,0,0,CA,PST, ,1134420,C,19,HNX,0,0,BROADCAST MEDIA, , , ,2,ESE,2,ESE,FIG GARDEN,05/20/2002,1255, , , , ,"Three lightning strikes were reported in and around the Bullard High School campus.","",83
5290966,FRESNO CO.,(FAT) AIR TERMINAL,05/20/2002,1445,Lightning, , ,0,0,5000,0,CA,PST, ,1134420,C,19,HNX,0,0,TRAINED SPOTTER, , , ,8,E,8,E,(FAT) AIR TERMINAL,05/20/2002,1445, , , , ,"Structure fire due to lightning hit.","",84
5290968,FRESNO CO.,KERMAN,05/20/2002,1511,Lightning, , ,0,0,0,0,CA,PST, ,1134420,C,19,HNX,0,0,TRAINED SPOTTER, , , ,5,NE,5,NE,KERMAN,05/20/2002,1511, , , , ,"","",85
5290865,KINGS CO.,AVENAL,05/31/2002,2125,Lightning, , ,0,0,5000,0,CA,PST, ,1134414,C,31,HNX,0,0,FIRE DEPT/RESCUE SQUAD, , , , , , , ,AVENAL,05/31/2002,2125, , , , ,"","Localized heavy rain at the Hanford Airport of 1.01" within a 21-minute time period totally flooded local streets and intersections. Despite heavy rain being highly localized (known locations at Hanford, Armona, Avenal, downtown Fresno, and Piedra area of Fresno County), lightning activity with this event was widespread, long-lasting, and very visual...an infrequent occurrence for the Central and Southern San Joaquin Valley.  There were 260 lightning strikes between just 1900 and 2000 PST through the Central and South San Joaquin Valley...and that activity continued to just after midnight PST as a band of convection moved north through Kings County and into Fresno County. A trained spotter reported lightning at the rate of 5-6 flashes/second around 2100 PST in the Pine Flat Reservoir location near Piedra.",86
5290866,KINGS CO.,HANFORD MUNI ARPT,05/31/2002,2215,Lightning, , ,0,0,5000,0,CA,PST, ,1134414,C,31,HNX,0,0,FIRE DEPT/RESCUE SQUAD, , , ,1,SSW,1,SSW,HANFORD MUNI ARPT,05/31/2002,2215, , , , ,"","Localized heavy rain at the Hanford Airport of 1.01" within a 21-minute time period totally flooded local streets and intersections. Despite heavy rain being highly localized (known locations at Hanford, Armona, Avenal, downtown Fresno, and Piedra area of Fresno County), lightning activity with this event was widespread, long-lasting, and very visual...an infrequent occurrence for the Central and Southern San Joaquin Valley.  There were 260 lightning strikes between just 1900 and 2000 PST through the Central and South San Joaquin Valley...and that activity continued to just after midnight PST as a band of convection moved north through Kings County and into Fresno County. A trained spotter reported lightning at the rate of 5-6 flashes/second around 2100 PST in the Pine Flat Reservoir location near Piedra.",87
5290862,KINGS CO.,HANFORD,05/31/2002,2217,Lightning, , ,0,0,0,0,CA,PST, ,1134413,C,31,HNX,0,0,NWS STORM SURVEY, , , ,7,N,7,N,HANFORD,05/31/2002,2217, , , , ,"","Remnants of Hurricane Alma interacted with a closed mid-latitude low providing moisture for a de-stabilizing air mass over Interior Central California in the late evening hours of Friday, May 31st.  The resulting widespread, late evening convection lead to strong, gusty wind in wet microbursts and street flooding from localized, torrential rains. The most visual damage occurred with a series of very small microbursts evidenced by crop damage in North Kings County.  Also a late report of 3/4+" hail was received from North Kings County.",88
5290867,KINGS CO.,HANFORD,05/31/2002,2217,Lightning, , ,0,0,5000,0,CA,PST, ,1134414,C,31,HNX,0,0,FIRE DEPT/RESCUE SQUAD, , , ,7,N,7,N,HANFORD,05/31/2002,2217, , , , ,"","Localized heavy rain at the Hanford Airport of 1.01" within a 21-minute time period totally flooded local streets and intersections. Despite heavy rain being highly localized (known locations at Hanford, Armona, Avenal, downtown Fresno, and Piedra area of Fresno County), lightning activity with this event was widespread, long-lasting, and very visual...an infrequent occurrence for the Central and Southern San Joaquin Valley.  There were 260 lightning strikes between just 1900 and 2000 PST through the Central and South San Joaquin Valley...and that activity continued to just after midnight PST as a band of convection moved north through Kings County and into Fresno County. A trained spotter reported lightning at the rate of 5-6 flashes/second around 2100 PST in the Pine Flat Reservoir location near Piedra.",89
5322831,SAN DIEGO CO.,LA MESA,11/29/2002,2022,Lightning, , ,0,0,0,0,CA,PST, ,1144620,C,73,SGX,0,0,LAW ENFORCEMENT, , , ,3,SW,3,SW,LA MESA,11/29/2002,2022, , , , ,"","Frequent lightning, heavy rain, and small hail were observed at many locations as a band of thunderstorms moved north and west across Southwest California. A roof collapsed from heavy rain in El Cajon. Several vehicles attempting to cross a flooded road way in Mission Valley became stranded. Four parked vehicles were washed into Alvardo Creek. At the junction of Alvardo Creek and the San Diego River, 18 vehicles in an Auto Dealership yard were flooded. North of Fallbrook, 15 vehicles were stuck in mudslides. Lightning struck several trees and power lines, causing minor fires",90
5354654,TULARE CO.,GOSHEN,05/14/2003,1245,Lightning, , ,0,0,0,0,CA,PST, ,1151539,C,107,HNX,0,0,NEWSPAPER, , , ,2,S,2,S,GOSHEN,05/14/2003,1245, , , , ,"","Lightning, strong wind, and pea-sized hail accompanied convective activity that spread over the South-Central part of the San Joaquin Valley in the afternoon of the 14th. Newspaper reports noted several lightning strikes in and around the city of Visalia.",91
5354655,TULARE CO.,VISALIA ARPT,05/14/2003,1245,Lightning, , ,0,0,3000,0,CA,PST, ,1151539,C,107,HNX,0,0,NEWSPAPER, , , ,1,SE,1,SE,VISALIA ARPT,05/14/2003,1245, , , , ,"","Lightning, strong wind, and pea-sized hail accompanied convective activity that spread over the South-Central part of the San Joaquin Valley in the afternoon of the 14th. Newspaper reports noted several lightning strikes in and around the city of Visalia.",92
5354653,TULARE CO.,TIPTON,05/14/2003,1405,Lightning, , ,0,0,0,0,CA,PST, ,1151539,C,107,HNX,0,0,NEWSPAPER, , , ,10,W,10,W,TIPTON,05/14/2003,1405, , , , ,"","Lightning, strong wind, and pea-sized hail accompanied convective activity that spread over the South-Central part of the San Joaquin Valley in the afternoon of the 14th. Newspaper reports noted several lightning strikes in and around the city of Visalia.",93
5367316,TULARE CO.,MINERAL KING,07/25/2003,800,Lightning, , ,0,0,0,0,CA,PST, ,1156052,C,107,HNX,0,0,NEWSPAPER, , , ,9,SW,9,SW,MINERAL KING,07/25/2003,1400, , , , ,"The Coffeepot Fire was one of five lightning fires in the Tulare County area from thunderstorm activity in the past two weeks in the Tulare County Mountains. The Coffeepot fire damage or cause is not known with no lives or structures reported lost.","",94
5378414,LOS ANGELES CO.,DUARTE,07/28/2003,2145,Lightning, , ,0,1,0,0,CA,PST, ,1158954,C,37,LOX,0,0,NEWSPAPER, , , , , , , ,DUARTE,07/28/2003,2145, , , , ,"In Duarte, an 11 year-old boy was struck by lightning. The child only sustained minor injuries.","",95
5367218,KERN CO.,(BFL)MEADOWS FIELD AP,07/30/2003,200,Lightning, , ,0,0,0,0,CA,PST, ,1156035,C,29,HNX,0,0,OFFICIAL NWS OBS., , , ,10,E, , ,TAFT,07/30/2003,530, , , , ,"","Monsoonal moisture advected northwest around high pressure persistently centered over the Southwest U.S. supported nocturnal thunderstorm activity the night of the 29th and early the morning of the 30th. Many lightning strikes occurred on the South San Joaquin Valley floor beginning around 2 AM PDT just east of Bakersfield. As the thunderstorms moved westward over the South Valley a peak in lightning activity occurred by 4 AM in the Southwest Bakersfield Metropolitan area itself ... and subsequently moved westward toward Taft by 6 AM.",96
5367315,KERN CO.,TAFT,07/30/2003,245,Lightning, , ,0,0,50000,0,CA,PST, ,1156051,C,29,HNX,0,0,NEWSPAPER, , , , , , , ,MC KITTRICK,07/30/2003,700, , , , ,"Numerous power pole and grass fires were touched off by lightning strikes in the Southwest San Joaquin Valley from Taft northward to Fellows during the wee hours of the morning of the 30th. Over 8000 utility customers lost power during the thunderstorm/lightning episode in the Kern County area, including 4000 customers on the West Side of the South Valley.","",97
5367313,KERN CO.,(BFL)MEADOWS FIELD AP,07/30/2003,329,Lightning, , ,0,0,75000,0,CA,PST, ,1156049,C,29,HNX,0,0,NEWSPAPER, , , ,2,WSW,2,WSW,(BFL)MEADOWS FIELD AP,07/30/2003,329, , , , ,"A lightning strike on a house in Northwest Bakersfield caused damage from fire. There were numerous lightning strikes in Kern County during the early morning hours of the 30th, including tens of strikes in the Bakersfield Metropolitan area.","",98
5365836,RIVERSIDE CO.,ROMOLAND,07/30/2003,702,Lightning, , ,1,0,0,0,CA,PST, ,1155937,C,65,SGX,0,0,NEWSPAPER, , , , , , , ,ROMOLAND,07/30/2003,702, , , , ,"","A construction worker standing on a catwalk and washing down fiberglass water tanks, was struck by lightning and fell 30 feet to the ground. He was in cardiac arrest when Paramedics arrived, transported to the hospital, and pronounced dead at 0758 PST.",99
5367222,KERN CO.,DELANO,07/30/2003,1000,Lightning, , ,0,0,0,0,CA,PST, ,1156037,C,29,HNX,0,0,OFFICIAL NWS OBS., , , , , , , ,DELANO,07/30/2003,1015, , , , ,"","A west-to-east line of convection developed over the Kings-Tulare-Kern County line through the Southern San Joaquin Valley by 11 AM PDT on the 30th. Monsoonal moisture aloft from the east in combination with high surface heating brought lightning over the southwest portion of Tulare County in and around Delano. Over the next couple of hours the line slowly translated north with a center of lightning activity ending at Corcoran in Kings County around 1 PM PDT.",100
5367220,TULARE CO.,EARLIMART,07/30/2003,1000,Lightning, , ,0,0,0,0,CA,PST, ,1156037,C,107,HNX,0,0,OFFICIAL NWS OBS., , , ,9,SSE, , ,BLANCO,07/30/2003,1145, , , , ,"","A west-to-east line of convection developed over the Kings-Tulare-Kern County line through the Southern San Joaquin Valley by 11 AM PDT on the 30th. Monsoonal moisture aloft from the east in combination with high surface heating brought lightning over the southwest portion of Tulare County in and around Delano. Over the next couple of hours the line slowly translated north with a center of lightning activity ending at Corcoran in Kings County around 1 PM PDT.",101
5367221,KINGS CO.,CORCORAN,07/30/2003,1145,Lightning, , ,0,0,0,0,CA,PST, ,1156037,C,31,HNX,0,0,OFFICIAL NWS OBS., , , , , , , ,CORCORAN,07/30/2003,1145, , , , ,"","A west-to-east line of convection developed over the Kings-Tulare-Kern County line through the Southern San Joaquin Valley by 11 AM PDT on the 30th. Monsoonal moisture aloft from the east in combination with high surface heating brought lightning over the southwest portion of Tulare County in and around Delano. Over the next couple of hours the line slowly translated north with a center of lightning activity ending at Corcoran in Kings County around 1 PM PDT.",102
5369447,SAN BERNARDINO CO.,BIG BEAR CITY,08/14/2003,1300,Lightning, , ,0,0,0,0,CA,PST, ,1160178,C,71,SGX,0,0,NEWSPAPER, , , ,6,E,6,E,BIG BEAR CITY,08/18/2003,900, , , , ,"","Lightning started a wildfire in the San Bernardino National forest. Steep terrain hampered fire fighting efforts, but after four days it still posed no threat to public safety.",103
5333444,TULARE CO.,PORTERVILLE,08/20/2003,2013,Lightning, , ,0,0,0,40000,CA,PST, ,1161738,C,107,HNX,0,0,NEWSPAPER, , , ,3,SW,3,SW,PORTERVILLE,08/20/2003,2013, , , , ,"","High wind from a thunderstorm led to power transmission line damage, subsequent power outage, and reports from spotters of visibility restrictions from blowing dust in the Lindsay area on the 20th due to a collapsing thunderstorm cell. A lightning strike ignited a stack of 800 bales of hay southwest of Porterville as well as two other locations within the city limits of Porterville.",104
5333446,TULARE CO.,PORTERVILLE,08/20/2003,2056,Lightning, , ,0,0,1000,0,CA,PST, ,1161738,C,107,HNX,0,0,NEWSPAPER, , , ,1,N,1,N,PORTERVILLE,08/20/2003,2056, , , , ,"","High wind from a thunderstorm led to power transmission line damage, subsequent power outage, and reports from spotters of visibility restrictions from blowing dust in the Lindsay area on the 20th due to a collapsing thunderstorm cell. A lightning strike ignited a stack of 800 bales of hay southwest of Porterville as well as two other locations within the city limits of Porterville.",105
5333447,TULARE CO.,PORTERVILLE,08/20/2003,2127,Lightning, , ,0,0,1000,0,CA,PST, ,1161738,C,107,HNX,0,0,NEWSPAPER, , , ,1,W,1,W,PORTERVILLE,08/20/2003,2127, , , , ,"","High wind from a thunderstorm led to power transmission line damage, subsequent power outage, and reports from spotters of visibility restrictions from blowing dust in the Lindsay area on the 20th due to a collapsing thunderstorm cell. A lightning strike ignited a stack of 800 bales of hay southwest of Porterville as well as two other locations within the city limits of Porterville.",106
5369456,RIVERSIDE CO.,SAGE,08/24/2003,530,Lightning, , ,0,0,20000,0,CA,PST, ,1160187,C,65,SGX,0,0,LAW ENFORCEMENT, , , , , , , ,HEMET,08/24/2003,745, , , , ,"","Lightning associated with pre-dawn thunderstorms struck a house, setting the roof afire and a palm tree. Wind gusts to 34 mph and heavy rain were also observed, which led to minor urban flooding.",107
5369443,SAN DIEGO CO.,ALPINE,08/24/2003,1245,Lightning, , ,0,0,0,0,CA,PST, ,1160174,C,73,SGX,0,0,NEWSPAPER, , , ,5,SE, , ,PALOMAR MTN,08/24/2003,1600, , , , ,"","Three separate brush fires were started by lightning, burning a total of 10 acres. Heavy rains from thunderstorms quickly extinguished them.",108
5369521,SAN BERNARDINO CO.,HESPERIA,08/24/2003,1400,Lightning, , ,0,0,2000,0,CA,PST, ,1160194,C,71,SGX,0,0,NEWSPAPER, , , ,3,W,3,W,HESPERIA,08/24/2003,1400, , , , ,"","Lightning struck a house, causing minor damage to the roof.",109
5332494,MARIPOSA CO.,COUNTYWIDE,08/26/2003,30,Lightning, , ,0,0,0,0,CA,PST, ,1161723,C,43,HNX,0,0,OFFICIAL NWS OBS., , , , , , , ,COUNTYWIDE,08/26/2003,530, , , , ,"","Another surge of monsoonal moisture from the remnants of Hurricane Ignacio brought thunderstorm activity to the deserts and higher terrain of Interior Central California. With east to southeast wind flow aloft, thunderstorms developed and moved over the Central and Southern San Joaquin Valley early on the morning of the 26th. Many lightning strikes again occurred. Infrequently occurring, the Central San Joaquin Valley began taking lightning strikes by 0200 PST and continuing heavily from Mariposa County south through Madera County and west to Merced County through 0430 PST. Additional lightning activity began in earnest on the west side of Fresno County at 0430 PST with a pocket of lightning activity in the Bakersfield Metropolitan area near dawn. Over 300 lightning strikes occurred in the 6-county area of Interior Central California from 0400 to 0500 PST alone. Merced County fire crews responded to over 14 lightning-caused fires on the Valley floor and resulted in loss of power to over 3500 customers in the Merced/Atwater area.",110
5332495,MERCED CO.,COUNTYWIDE,08/26/2003,100,Lightning, , ,0,0,0,0,CA,PST, ,1161723,C,47,HNX,0,0,OFFICIAL NWS OBS., , , , , , , ,COUNTYWIDE,08/26/2003,530, , , , ,"","Another surge of monsoonal moisture from the remnants of Hurricane Ignacio brought thunderstorm activity to the deserts and higher terrain of Interior Central California. With east to southeast wind flow aloft, thunderstorms developed and moved over the Central and Southern San Joaquin Valley early on the morning of the 26th. Many lightning strikes again occurred. Infrequently occurring, the Central San Joaquin Valley began taking lightning strikes by 0200 PST and continuing heavily from Mariposa County south through Madera County and west to Merced County through 0430 PST. Additional lightning activity began in earnest on the west side of Fresno County at 0430 PST with a pocket of lightning activity in the Bakersfield Metropolitan area near dawn. Over 300 lightning strikes occurred in the 6-county area of Interior Central California from 0400 to 0500 PST alone. Merced County fire crews responded to over 14 lightning-caused fires on the Valley floor and resulted in loss of power to over 3500 customers in the Merced/Atwater area.",111
5332496,MADERA CO.,COUNTYWIDE,08/26/2003,130,Lightning, , ,0,0,0,0,CA,PST, ,1161723,C,39,HNX,0,0,OFFICIAL NWS OBS., , , , , , , ,COUNTYWIDE,08/26/2003,530, , , , ,"","Another surge of monsoonal moisture from the remnants of Hurricane Ignacio brought thunderstorm activity to the deserts and higher terrain of Interior Central California. With east to southeast wind flow aloft, thunderstorms developed and moved over the Central and Southern San Joaquin Valley early on the morning of the 26th. Many lightning strikes again occurred. Infrequently occurring, the Central San Joaquin Valley began taking lightning strikes by 0200 PST and continuing heavily from Mariposa County south through Madera County and west to Merced County through 0430 PST. Additional lightning activity began in earnest on the west side of Fresno County at 0430 PST with a pocket of lightning activity in the Bakersfield Metropolitan area near dawn. Over 300 lightning strikes occurred in the 6-county area of Interior Central California from 0400 to 0500 PST alone. Merced County fire crews responded to over 14 lightning-caused fires on the Valley floor and resulted in loss of power to over 3500 customers in the Merced/Atwater area.",112
5332497,FRESNO CO.,COUNTYWIDE,08/26/2003,430,Lightning, , ,0,0,0,0,CA,PST, ,1161723,C,19,HNX,0,0,OFFICIAL NWS OBS., , , , , , , ,COUNTYWIDE,08/26/2003,630, , , , ,"","Another surge of monsoonal moisture from the remnants of Hurricane Ignacio brought thunderstorm activity to the deserts and higher terrain of Interior Central California. With east to southeast wind flow aloft, thunderstorms developed and moved over the Central and Southern San Joaquin Valley early on the morning of the 26th. Many lightning strikes again occurred. Infrequently occurring, the Central San Joaquin Valley began taking lightning strikes by 0200 PST and continuing heavily from Mariposa County south through Madera County and west to Merced County through 0430 PST. Additional lightning activity began in earnest on the west side of Fresno County at 0430 PST with a pocket of lightning activity in the Bakersfield Metropolitan area near dawn. Over 300 lightning strikes occurred in the 6-county area of Interior Central California from 0400 to 0500 PST alone. Merced County fire crews responded to over 14 lightning-caused fires on the Valley floor and resulted in loss of power to over 3500 customers in the Merced/Atwater area.",113
5332498,KERN CO.,COUNTYWIDE,08/26/2003,430,Lightning, , ,0,0,0,0,CA,PST, ,1161723,C,29,HNX,0,0,OFFICIAL NWS OBS., , , , , , , ,COUNTYWIDE,08/26/2003,730, , , , ,"","Another surge of monsoonal moisture from the remnants of Hurricane Ignacio brought thunderstorm activity to the deserts and higher terrain of Interior Central California. With east to southeast wind flow aloft, thunderstorms developed and moved over the Central and Southern San Joaquin Valley early on the morning of the 26th. Many lightning strikes again occurred. Infrequently occurring, the Central San Joaquin Valley began taking lightning strikes by 0200 PST and continuing heavily from Mariposa County south through Madera County and west to Merced County through 0430 PST. Additional lightning activity began in earnest on the west side of Fresno County at 0430 PST with a pocket of lightning activity in the Bakersfield Metropolitan area near dawn. Over 300 lightning strikes occurred in the 6-county area of Interior Central California from 0400 to 0500 PST alone. Merced County fire crews responded to over 14 lightning-caused fires on the Valley floor and resulted in loss of power to over 3500 customers in the Merced/Atwater area.",114
5369518,SAN BERNARDINO CO.,BIG BEAR CITY,08/28/2003,1000,Lightning, , ,0,0,40000,0,CA,PST, ,1160191,C,71,SGX,0,0,NEWSPAPER, , , , , , , ,BIG BEAR CITY,08/28/2003,1300, , , , ,"","A brush fire consumed 7 acres in the area adjacent to the Oak Ridge Estates. No homes or structures were lost and no one was injured. Lightning caused phone and power outages in the Big Bear Lake area earlier this day, and may have been the cause of this fire.",115
5337479,SAN DIEGO CO.,SANTA YSABEL,09/02/2003,1455,Lightning, , ,0,0,0,0,CA,PST, ,1162355,C,73,SGX,0,0,NEWSPAPER, , , ,3,SE,4,E,LA MESA,09/02/2003,1505, , , , ,"","Lightning started six separate fires, but fire fighters and heavy rains put them out before any major damage occurred.",116
5337817,TULARE CO.,JOHNSONDALE,09/02/2003,2200,Lightning, , ,0,0,0,0,CA,PST, ,1162955,C,107,HNX,0,0,NEWSPAPER, , , , , , , ,CALIFORNIA HOT SPGS,09/02/2003,2300, , , , ,"","A large amount of convective activity developed in the Kern Desert areas late in the afternoon of the 2nd. Spotter reports indicated at least a couple of microbursts in and around Edwards AFB just before 5 PM PST as some minor damage was reported in Rosamond and strong, gusty winds occurred later at meso-net sites northwest and north of Edwards. Nearly 50 lightning strikes were reported as thunderstorm activity moved from the Kern Deserts into the Kern Mountains and Tulare County Mountains by late evening. Over 14 fires were started by lightning strikes on the 2nd and 3rd of September in the Sequoia-Kings National Park area of the Tulare County Mountains.",117
