EVENT_ID,CZ_NAME_STR,BEGIN_LOCATION,BEGIN_DATE,BEGIN_TIME,EVENT_TYPE,MAGNITUDE,TOR_F_SCALE,DEATHS_DIRECT,INJURIES_DIRECT,DAMAGE_PROPERTY_NUM,DAMAGE_CROPS_NUM,STATE_ABBR,CZ_TIMEZONE,MAGNITUDE_TYPE,EPISODE_ID,CZ_TYPE,CZ_FIPS,WFO,INJURIES_INDIRECT,DEATHS_INDIRECT,SOURCE,FLOOD_CAUSE,TOR_LENGTH,TOR_WIDTH,BEGIN_RANGE,BEGIN_AZIMUTH,END_RANGE,END_AZIMUTH,END_LOCATION,END_DATE,END_TIME,BEGIN_LAT,BEGIN_LON,END_LAT,END_LON,EVENT_NARRATIVE,EPISODE_NARRATIVE,ABSOLUTE_ROWNUMBER
602874,SAN BERNARDINO CO.,RAINBOW,09/09/2015,1300,Lightning, , ,0,0,500,0,CA,PST-8, ,100747,C,71,SGX,0,0,Law Enforcement, , , ,60,NNE,60,NNE,RAINBOW,09/09/2015,1330,34.2107,-116.7297,34.2107,-116.7297,"CHP reported a lightning-started brush fire along Highway 38 near Onyx Peak.","Subtropical moisture from the remnants of Hurricane Linda brought widespread showers to most of the area, deserts included. The first isolated thunderstorm developed on the 6th in San Diego County as a moisture surge in monsoon warm upper level flow arrived. Intense heavy rain from thunderstorms occurred on the 7th with flash flooding in several locations including Victorville and Forest Falls. A swift water rescue in Victorville was successful, but another incident in Forest Falls had one rescue but a drowning occurred when a 30-year-old couple crossed Mill Creek and were swept away. Most areas received between a few hundredths to one-third of an inch of rain, with a few upslope areas of the San Bernardino Mountains receiving up to around one inch. Additional thunderstorms developed on the 8th by noon over the mountains and quickly spread into the Inland Empire and Orange County, as well as near I-15 in San Diego County. Locally heavy rain and several trees and poles were downed in the Riverside area including a small dust storm. Several hail reports, mostly nickel-sized, but a few larger. Activity decreased on the 9th with only isolated thunderstorms formed.",262
602831,SAN BERNARDINO CO.,LANDERS,10/15/2015,120,Lightning, , ,0,0,10000,0,CA,PST-8, ,100619,C,71,VEF,0,0,Broadcast Media, , , ,0,N,0,N,TWENTY NINE PALMS,10/15/2015,215,34.27,-116.4,34.13,-116.05,"Lightning knocked out power to over 4000 customers and set fire to a palm tree between Landers and Twentynine Palms.","An upper level low pressure system brought a round of thunderstorms to the Mojave Desert and southern Great Basin. Significant flash flooding occurred, along with isolated severe weather.",263
602836,SAN BERNARDINO CO.,JOSHUA TREE,10/15/2015,1430,Lightning, , ,0,0,25000,0,CA,PST-8, ,100619,C,71,VEF,0,0,Broadcast Media, , , ,0,N,0,N,TWENTY NINE PALMS,10/15/2015,2010,34.13,-116.32,34.13,-116.05,"Lightning set fire to five trees and one power pole in Joshua Tree and Twentynine Palms.","An upper level low pressure system brought a round of thunderstorms to the Mojave Desert and southern Great Basin. Significant flash flooding occurred, along with isolated severe weather.",264
627011,ORANGE CO.,GALIVAN,03/07/2016,715,Lightning, , ,0,0,2000,0,CA,PST-8, ,104284,C,59,SGX,0,0,Fire Department/Rescue, , , ,2,SSW,2,SSW,GALIVAN,03/07/2016,745,33.5593,-117.6604,33.5593,-117.6604,"A lightning strike from a line of thunderstorms caused a roof fire at a house in Laguna Niguel.","Multiple troughs embedded within a broader upper-level low brought rain and snow showers, scattered thunderstorms with small hail, minor coastal flooding and gusty winds between the 6th and 8th. Precipitation totals ranged from 1.5 inches of rain in the coast and valleys to isolated 3 inch amounts in the mountains. Snow accumulated down to 3500 ft with up to 9 inches above 7000 ft. Considerable wind damage occurred with 2 lines of thunderstorms that moved through Orange and San Diego Counties on the 7th, with numerous trees down blocking roadways and damage to roofs, windows, and cars.",265
639621,MERCED CO.,SANTA NELLA,05/05/2016,1834,Lightning, , ,0,0,1000000,0,CA,PST-8, ,106281,C,47,HNX,0,0,Law Enforcement, , , ,8,W,8,W,SANTA NELLA,05/05/2016,1835,37.1018,-121.1383,37.1018,-121.1383,"California Highway Patrol reported vehicle struck by lightning on SR 152 west of Los Banos at 1834 PST. Vehicle was disabled and no injuries were reported.","Slow moving upper level low pressure system just west of the coast of California allowed for a large influx of moisture to move into central California which set the stage for heavy rain bands and embedded thunderstorms to develop for two days in a row. Flooding was observed in many locations.",266
630346,INYO CO.,BISHOP,06/11/2016,2120,Lightning, , ,0,0,1000,0,CA,PST-8, ,105199,C,27,VEF,0,0,Law Enforcement, , , ,4,WNW,4,WNW,BISHOP,06/11/2016,2120,37.3838,-118.4436,37.3838,-118.4436,"Lightning started a fire near the gun club just north of West Bishop.","Lightning from isolated thunderstorms in the Owens Valley started a fire.",267
649597,SAN BERNARDINO CO.,KELSO,08/02/2016,1544,Lightning, , ,0,0,10000,0,CA,PST-8, ,108103,C,71,VEF,0,0,Park/Forest Service, , , ,1,SSW,1,SSW,KELSO,08/02/2016,1544,35.0116,-115.6537,35.0116,-115.6537,"Lightning set fire to a power pole at the intersection of Kelbaker Road and Kelso Cima Road.","A monsoon moisture push which began on July 27th continued into August 5th, bringing considerable flash flooding and isolated severe weather.",268
661636,SAN DIEGO CO.,GRANTVILLE,09/19/2016,500,Lightning, , ,0,0,10000,0,CA,PST-8, ,110820,C,73,SGX,0,0,Broadcast Media, , , ,1,W,1,W,GRANTVILLE,09/19/2016,800,32.7792,-117.0964,32.7792,-117.0964,"A band of convection formed along the leading edge of moisture from former Hurricane Paine as it moved northward. Numerous lightning strikes occurred in San Diego County setting palm trees on fire and causing power outages to 4000 customers.","An upper-level trough off the SoCal coast pulled tropical moisture from former Hurricane Paine northward into the area, bringing unsettled weather from the 19th-21st. Unusual lightning activity occurred over the San Diego Metro on the 19th. San Diego and Riverside Counties saw unseasonable rainfall, with one-quarter to one-half of an inch falling over the coastal and valleys, and one-half to one and a half inches in the mountains and deserts. The rainfall delayed a San Diego Padres baseball game at Petco Park on the 20th, and increased September rainfall to more than 200% of normal over San Diego and Riverside Counties. When the trough moved through the region on the 22nd strong winds surfaced in the deserts bring areas of blowing dust and sand.",269
663088,RIVERSIDE CO.,CORONA,10/23/2016,1900,Lightning, , ,0,0,6000,0,CA,PST-8, ,111154,C,65,SGX,0,0,Public, , , ,1,NNW,1,NNW,CORONA,10/23/2016,2000,33.8834,-117.5867,33.8834,-117.5867,"Multiple utility poles down, likely caused by frequent cloud to ground lightning.","A widespread elevated thunderstorm event occurred  across northern San Diego, Orange, western Riverside and southwest San Bernardino counties lasting up to 24 hours and producing 2500 cloud to ground strikes (4000 total flashes) over the land and California bight waters. Toward the end of the episode thunderstorms affected southern San Diego county. An upper level trough approached the coast and tapped subtropical moisture from the south. The main area of showers and thunderstorms was oriented southwest to northeast from northern San Diego County and Orange County through the Inland Empire and up into San Bernardino County high deserts, training over this area for most of the day and night of the 23rd. Two-day rainfall totals were from one-quarter to one inch for most areas and locally just over one inch on the coastal slopes of the San Bernardino mountains. San Diego county had the least with 0.25 or less and the most was the greater Riverside area with up to an inch of rain. Minor street flooding occurred in Orange and Riverside Counties.  Several power poles were downed or burned due to lightning strikes. One strike hit a football player practicing at Grossmont High School in El Cajon, but he survived.",270
663089,SAN BERNARDINO CO.,APPLE VLY,10/23/2016,1930,Lightning, , ,0,0,10000,0,CA,PST-8, ,111154,C,71,SGX,0,0,Fire Department/Rescue, , , ,2,SE,2,SE,APPLE VLY,10/23/2016,2015,34.4995,-117.1752,34.4995,-117.1752,"Multiple power lines and transformers damaged by lightning strikes.","A widespread elevated thunderstorm event occurred  across northern San Diego, Orange, western Riverside and southwest San Bernardino counties lasting up to 24 hours and producing 2500 cloud to ground strikes (4000 total flashes) over the land and California bight waters. Toward the end of the episode thunderstorms affected southern San Diego county. An upper level trough approached the coast and tapped subtropical moisture from the south. The main area of showers and thunderstorms was oriented southwest to northeast from northern San Diego County and Orange County through the Inland Empire and up into San Bernardino County high deserts, training over this area for most of the day and night of the 23rd. Two-day rainfall totals were from one-quarter to one inch for most areas and locally just over one inch on the coastal slopes of the San Bernardino mountains. San Diego county had the least with 0.25 or less and the most was the greater Riverside area with up to an inch of rain. Minor street flooding occurred in Orange and Riverside Counties.  Several power poles were downed or burned due to lightning strikes. One strike hit a football player practicing at Grossmont High School in El Cajon, but he survived.",271
663087,RIVERSIDE CO.,WOODCREST,10/24/2016,700,Lightning, , ,0,0,2000,0,CA,PST-8, ,111154,C,65,SGX,0,0,Law Enforcement, , , ,1,E,1,E,WOODCREST,10/24/2016,800,33.88,-117.3326,33.88,-117.3326,"CHP reported a fire due to power lines downed from a lightning strike.","A widespread elevated thunderstorm event occurred  across northern San Diego, Orange, western Riverside and southwest San Bernardino counties lasting up to 24 hours and producing 2500 cloud to ground strikes (4000 total flashes) over the land and California bight waters. Toward the end of the episode thunderstorms affected southern San Diego county. An upper level trough approached the coast and tapped subtropical moisture from the south. The main area of showers and thunderstorms was oriented southwest to northeast from northern San Diego County and Orange County through the Inland Empire and up into San Bernardino County high deserts, training over this area for most of the day and night of the 23rd. Two-day rainfall totals were from one-quarter to one inch for most areas and locally just over one inch on the coastal slopes of the San Bernardino mountains. San Diego county had the least with 0.25 or less and the most was the greater Riverside area with up to an inch of rain. Minor street flooding occurred in Orange and Riverside Counties.  Several power poles were downed or burned due to lightning strikes. One strike hit a football player practicing at Grossmont High School in El Cajon, but he survived.",272
663090,SAN BERNARDINO CO.,APPLE VLY,10/24/2016,700,Lightning, , ,0,0,12000,0,CA,PST-8, ,111154,C,71,SGX,0,0,Trained Spotter, , , ,8,SE,1,WNW,HIGHLAND,10/24/2016,800,34.4381,-117.1007,34.1355,-117.2162,"Several power poles down across streets in Highland, with lines down across yards, likely due to a lightning strike. Lightning struck a power pole, pole and lines down on roadway southeast of Apple Valley.","A widespread elevated thunderstorm event occurred  across northern San Diego, Orange, western Riverside and southwest San Bernardino counties lasting up to 24 hours and producing 2500 cloud to ground strikes (4000 total flashes) over the land and California bight waters. Toward the end of the episode thunderstorms affected southern San Diego county. An upper level trough approached the coast and tapped subtropical moisture from the south. The main area of showers and thunderstorms was oriented southwest to northeast from northern San Diego County and Orange County through the Inland Empire and up into San Bernardino County high deserts, training over this area for most of the day and night of the 23rd. Two-day rainfall totals were from one-quarter to one inch for most areas and locally just over one inch on the coastal slopes of the San Bernardino mountains. San Diego county had the least with 0.25 or less and the most was the greater Riverside area with up to an inch of rain. Minor street flooding occurred in Orange and Riverside Counties.  Several power poles were downed or burned due to lightning strikes. One strike hit a football player practicing at Grossmont High School in El Cajon, but he survived.",273
663092,SAN DIEGO CO.,RAINBOW,10/24/2016,1500,Lightning, , ,0,0,1500,0,CA,PST-8, ,111154,C,73,SGX,0,0,Department of Highways, , , ,0,N,0,N,RAINBOW,10/24/2016,1530,33.42,-117.15,33.42,-117.15,"Lightning struck a tree which caught on fire.","A widespread elevated thunderstorm event occurred  across northern San Diego, Orange, western Riverside and southwest San Bernardino counties lasting up to 24 hours and producing 2500 cloud to ground strikes (4000 total flashes) over the land and California bight waters. Toward the end of the episode thunderstorms affected southern San Diego county. An upper level trough approached the coast and tapped subtropical moisture from the south. The main area of showers and thunderstorms was oriented southwest to northeast from northern San Diego County and Orange County through the Inland Empire and up into San Bernardino County high deserts, training over this area for most of the day and night of the 23rd. Two-day rainfall totals were from one-quarter to one inch for most areas and locally just over one inch on the coastal slopes of the San Bernardino mountains. San Diego county had the least with 0.25 or less and the most was the greater Riverside area with up to an inch of rain. Minor street flooding occurred in Orange and Riverside Counties.  Several power poles were downed or burned due to lightning strikes. One strike hit a football player practicing at Grossmont High School in El Cajon, but he survived.",274
663093,SAN DIEGO CO.,LA MESA,10/24/2016,1730,Lightning, , ,0,1,0,0,CA,PST-8, ,111154,C,73,SGX,0,0,Broadcast Media, , , ,2,ENE,2,ENE,LA MESA,10/24/2016,1830,32.7811,-117.0182,32.7811,-117.0182,"A teenage football player was sent to the emergency room after getting struck by lightning at Grossmont High School. The player survived the strike.","A widespread elevated thunderstorm event occurred  across northern San Diego, Orange, western Riverside and southwest San Bernardino counties lasting up to 24 hours and producing 2500 cloud to ground strikes (4000 total flashes) over the land and California bight waters. Toward the end of the episode thunderstorms affected southern San Diego county. An upper level trough approached the coast and tapped subtropical moisture from the south. The main area of showers and thunderstorms was oriented southwest to northeast from northern San Diego County and Orange County through the Inland Empire and up into San Bernardino County high deserts, training over this area for most of the day and night of the 23rd. Two-day rainfall totals were from one-quarter to one inch for most areas and locally just over one inch on the coastal slopes of the San Bernardino mountains. San Diego county had the least with 0.25 or less and the most was the greater Riverside area with up to an inch of rain. Minor street flooding occurred in Orange and Riverside Counties.  Several power poles were downed or burned due to lightning strikes. One strike hit a football player practicing at Grossmont High School in El Cajon, but he survived.",275
675763,SAN FRANCISCO CO.,CRISSY AAF,01/20/2017,435,Lightning, , ,0,0,10,10,CA,PST-8, ,113024,C,75,MTR,0,0,Public, , , ,4,E,4,E,CRISSY AAF,01/20/2017,440,37.7952,-122.4028,37.7952,-122.4028,"Photos of lightning striking the Transamerica Pyramid building shared on social media.","The second in a series of three storms between January 18-23. Storm two occurred January 19-20. Heavy rain, strong winds, and small hail were observed with this frontal system as well as lightning strikes in San Francisco.",276
675759,SAN FRANCISCO CO.,SAN FRANCISCO,01/20/2017,556,Lightning, , ,0,0,10,10,CA,PST-8, ,113024,C,75,MTR,0,0,Public, , , ,0,NNW,0,NNW,SAN FRANCISCO,01/20/2017,600,37.7552,-122.4529,37.7552,-122.4529,"Video of Sutro tower being struck by lightning shared on social media.","The second in a series of three storms between January 18-23. Storm two occurred January 19-20. Heavy rain, strong winds, and small hail were observed with this frontal system as well as lightning strikes in San Francisco.",277
675757,SAN FRANCISCO CO.,SAN FRANCISCO,01/22/2017,1338,Lightning, , ,0,0,10,10,CA,PST-8, ,113041,C,75,MTR,0,0,Trained Spotter, , , ,2,NNE,2,NNE,SAN FRANCISCO,01/22/2017,1339,37.78,-122.43,37.78,-122.43,"","Third in a series of three storm systems occurred from January 22 to January 23. Heavy rain, lightning, wind, hail, snow (above 2500 ft), and record breaking surf were observed with this system.",278
685647,STANISLAUS CO.,OAKDALE,03/21/2017,1200,Lightning, , ,0,0,200000,0,CA,PST-8, ,114394,C,99,STO,0,0,Public, , , ,0,N,0,N,OAKDALE,03/21/2017,1200,37.77,-120.85,37.77,-120.85,"Lightning hit a tree in Oakdale, CA, causing a fire in nearby electrical transformer and resulting in a power outage. Three homes and a few vehicles were reported damaged.","Strong storms developed behind a cold front, bringing abundant rain and severe weather, including a damaging micro-burst and large hail in the foothills.",279
688566,NAPA CO.,NAPA,03/21/2017,2300,Lightning, , ,0,0,0,0,CA,PST-8, ,114798,C,55,MTR,0,0,Newspaper, , , ,0,N,0,N,NAPA,03/21/2017,2301,38.3,-122.3,38.3,-122.3,"A tree was struck by lightning at Park Ave and Sonoma Street leaving thousands without power. Reported by the Napa Valley Register.","The SFO area was impacted by a series of mid/upper level troughs at the end of March that created isolated thunderstorms. Some of these thunderstorms resulted in damaging winds, lightning, pea sized hail, and minor roadway flooding.",280
690293,BUTTE CO.,CHICO,04/13/2017,1425,Lightning, , ,0,0,45000,0,CA,PST-8, ,114841,C,7,STO,0,0,Broadcast Media, , , ,1,W,1,W,CHICO,04/13/2017,1425,39.73,-121.84,39.73,-121.84,"Lightning struck a very large oak tree near Bidwell Mansion in Chico. Large tree limbs came down, damaging 9 cars. Report time based on radar.","Thunderstorms had periods of heavy rain and small hail, as well as a damaging lightning strike.",281
719296,RIVERSIDE CO.,WARNER SPGS,08/03/2017,200,Lightning, , ,0,0,5000,0,CA,PST-8, ,119943,C,65,SGX,0,0,Utility Company, , , ,39,N,39,N,WARNER SPGS,08/03/2017,300,33.8328,-116.5443,33.8328,-116.5443,"Lightning strikes produced power outages in Palm Springs.","The month began with a ridge of high pressure over the Great Basin and moderate easterly flow in the mid and upper levels. This allowed monsoon moisture to surge into the southern half of California August 1st-3rd. Severe storms occurred in the Inland Empire and San Diego County Valleys on the 1st. Storms focused more on the mountains and deserts on the 2nd and 3rd, with reduced intensity overall.",282
719297,RIVERSIDE CO.,DESERT HOT SPGS,08/03/2017,245,Lightning, , ,0,0,5000,0,CA,PST-8, ,119943,C,65,SGX,0,0,Utility Company, , , ,1,SSW,1,SSW,DESERT HOT SPGS,08/03/2017,345,33.9559,-116.5045,33.9559,-116.5045,"Lightning strikes produced power outages in Desert Hot Springs.","The month began with a ridge of high pressure over the Great Basin and moderate easterly flow in the mid and upper levels. This allowed monsoon moisture to surge into the southern half of California August 1st-3rd. Severe storms occurred in the Inland Empire and San Diego County Valleys on the 1st. Storms focused more on the mountains and deserts on the 2nd and 3rd, with reduced intensity overall.",283
720727,SAN BERNARDINO CO.,COLTON,08/31/2017,1800,Lightning, , ,0,0,15000,0,CA,PST-8, ,120282,C,71,SGX,0,0,County Official, , , ,2,NNE,2,NNE,COLTON,08/31/2017,1800,34.0728,-117.3143,34.0728,-117.3143,"A lightning strike damaged a critical power transformer in Colton, cutting power to 95% of the city. An estimated 50,000 customers lost power. Area schools closed due to a lack of power that lingered into the following day.","A large upper level ridge of warm air over the Great Basin brought persistent east to southeast flow over the region in late August. Strong flow and limited instability largely kept the convection below severe levels. However, weakening of the ridge on the 31st increased instability. This helped severe convection develop over the Inland Empire. Downburst wind intensity was aided by dry air in the low levels and record high temperatures.",284
720446,TULARE CO.,LODGEPOLE,09/03/2017,1130,Lightning, , ,0,3,0,0,CA,PST-8, ,119730,C,107,HNX,0,0,NWS Employee, , , ,5,E,5,E,LODGEPOLE,09/03/2017,1230,36.5976,-118.6343,36.5976,-118.6343,"A family of three were struck by lightning and injured while wilderness backpacking at Sequoia National Park.","A northwest surge of tropical moisture during the Labor Day weekend produced strong thunderstorms over the Kern County Mountains during the late afternoon of September 3. These thunderstorms produced heavy rain which caused flash flooding in the Frazier Park and Pine Mountain Club areas. The thunderstorms spread northward through the San Joaquin Valley along an outflow boundary which also produced wind gusts between 40 and 50 mph and blowing dust which reduced visibility to near zero.",285
723124,RIVERSIDE CO.,PALM DESERT,09/07/2017,1600,Lightning, , ,0,0,10000,0,CA,PST-8, ,120680,C,65,SGX,0,0,Broadcast Media, , , ,0,NNE,0,NNE,PALM DESERT,09/07/2017,1600,33.7252,-116.3768,33.7252,-116.3768,"A lightning strike struck a palm tree, catching the tree and a residence on fire.","The month picked up where August left off, with an active monsoon pattern bringing periods of showers and thunderstorms to the mountains and deserts. The storms were confined to the deserts where intense isolated strong/severe thunderstorms on the 7th, 8th and 9th produced damage and impacts. Flash flooding was especially intense in Palm Springs and Cathedral City on the 9th, where structures throughout the city were flooded and roads were covered in debris. At Palm Springs High School 31 classrooms were inundated. Major flood damage also occurred at the Safari Mobile Home Park. Palm Springs set a daily record with 1.19 inches of rainfall. Many trees were toppled on September 8th when 62 mph winds occurred at Thermal Airport.",286
722824,SAN DIEGO CO.,WARNER SPGS,09/09/2017,600,Lightning, , ,0,0,5000,0,CA,PST-8, ,120680,C,73,SGX,0,0,Broadcast Media, , , ,37,NNE,37,NNE,WARNER SPGS,09/09/2017,600,33.8075,-116.4975,33.8075,-116.4975,"A lightning strike knocked out power to 1000 customers in Palm Springs.","The month picked up where August left off, with an active monsoon pattern bringing periods of showers and thunderstorms to the mountains and deserts. The storms were confined to the deserts where intense isolated strong/severe thunderstorms on the 7th, 8th and 9th produced damage and impacts. Flash flooding was especially intense in Palm Springs and Cathedral City on the 9th, where structures throughout the city were flooded and roads were covered in debris. At Palm Springs High School 31 classrooms were inundated. Major flood damage also occurred at the Safari Mobile Home Park. Palm Springs set a daily record with 1.19 inches of rainfall. Many trees were toppled on September 8th when 62 mph winds occurred at Thermal Airport.",287
718744,SAN MATEO CO.,SHARP PARK,09/11/2017,649,Lightning, , ,0,0,0,0,CA,PST-8, ,119919,C,81,MTR,0,0,Trained Spotter, , , ,0,NW,0,NW,SHARP PARK,09/11/2017,654,37.6344,-122.4869,37.6344,-122.4869,"Lightning strike caused damage to a residence on Tablot Ave in Pacifica.","A disturbance rotating around an upper level low west of San Diego brought thunderstorm activity to the Bay Area on September 11. Widespread reports of lightning were received along with a few small hail reports and strong wind gusts. It has been reported that there were over 40,000 lightning strikes across the Central Coast of California during this event. Several brush fires were also ignited due to lightning strikes.",288
718745,SAN MATEO CO.,HALF MOON BAY ARPT,09/11/2017,1700,Lightning, , ,0,0,0,0,CA,PST-8, ,119919,C,81,MTR,0,0,Broadcast Media, , , ,1,WNW,1,WNW,HALF MOON BAY ARPT,09/11/2017,1705,37.5244,-122.5092,37.5244,-122.5092,"News report from KRON showed lightning struck a tree in San Mateo County on Pearl Ave causing a tree to crash into and damage a home.","A disturbance rotating around an upper level low west of San Diego brought thunderstorm activity to the Bay Area on September 11. Widespread reports of lightning were received along with a few small hail reports and strong wind gusts. It has been reported that there were over 40,000 lightning strikes across the Central Coast of California during this event. Several brush fires were also ignited due to lightning strikes.",289
718746,SAN FRANCISCO CO.,SAN FRANCISCO,09/11/2017,1736,Lightning, , ,0,0,0,0,CA,PST-8, ,119919,C,75,MTR,0,0,Trained Spotter, , , ,1,WNW,1,WNW,SAN FRANCISCO,09/11/2017,1741,37.76,-122.47,37.76,-122.47,"Trained spotter reported lightning.","A disturbance rotating around an upper level low west of San Diego brought thunderstorm activity to the Bay Area on September 11. Widespread reports of lightning were received along with a few small hail reports and strong wind gusts. It has been reported that there were over 40,000 lightning strikes across the Central Coast of California during this event. Several brush fires were also ignited due to lightning strikes.",290
