EVENT_ID,CZ_NAME_STR,BEGIN_LOCATION,BEGIN_DATE,BEGIN_TIME,EVENT_TYPE,MAGNITUDE,TOR_F_SCALE,DEATHS_DIRECT,INJURIES_DIRECT,DAMAGE_PROPERTY_NUM,DAMAGE_CROPS_NUM,STATE_ABBR,CZ_TIMEZONE,MAGNITUDE_TYPE,EPISODE_ID,CZ_TYPE,CZ_FIPS,WFO,INJURIES_INDIRECT,DEATHS_INDIRECT,SOURCE,FLOOD_CAUSE,TOR_LENGTH,TOR_WIDTH,BEGIN_RANGE,BEGIN_AZIMUTH,END_RANGE,END_AZIMUTH,END_LOCATION,END_DATE,END_TIME,BEGIN_LAT,BEGIN_LON,END_LAT,END_LON,EVENT_NARRATIVE,EPISODE_NARRATIVE,ABSOLUTE_ROWNUMBER
198201,SAN FRANCISCO CO.,SAN FRANCISCO,09/12/2009,430,Lightning, , ,0,0,120000,0,CA,PST-8, ,34225,C,75,MTR,0,0,Newspaper, , , ,0,N,0,N,SAN FRANCISCO,09/12/2009,530,37.75,-122.45,37.75,-122.45,"About 47,000 residents lost power around San Francisco as thunderstorms rolled through the city/county.  The largest outage affected 36,000 customers in parts of Sunset, Glen Park and Park Merced neighborhoods.  One lightning strike hit a power transformer causing it to explode.  Besides the total destruction of the power transformer, two vehicles were damaged at the intersection of Broderick and Sacramento Roads.","A low pressure system tapped into sub-tropical moisture causing hundreds of lightning strikes in thunderstorms around the San Francisco Bay Area, California.  Nearly 50,000 Bay Area residents lost power and dozens of small fires were started.",204
197465,SAN JOAQUIN CO.,COLLEGEVILLE,09/13/2009,1020,Lightning, , ,0,1,0,0,CA,PST-8, ,34080,C,77,STO,0,0,Newspaper, , , ,1,SSE,1,SSE,COLLEGEVILLE,09/13/2009,1020,37.8889,-121.214,37.8889,-121.214,"A woman was struck by lightning while carrying a large umbrella at a softball game at the San Joaquin Regional Sports Complex in Stockton.  Additional reports suggest the lightning hit about 30 feet away from her.  The woman suffered minor injuries.","Thunderstorms brought about 1500 recorded lightning strikes to northern California.  One lightning strike injured a woman at a sporting event in Stockton and a number of small wildfires were started across the area.",205
201147,YUBA CO.,MARYSVILLE,11/27/2009,1508,Lightning, , ,0,1,2000,0,CA,PST-8, ,34807,C,115,STO,0,0,Law Enforcement, , , ,2,SE,2,SE,MARYSVILLE,11/27/2009,1508,39.1295,-121.5736,39.1295,-121.5736,"CHP reported a woman injured when lightning struck power lines and went through a video game system she was playing.","A cold low pressure system bought showers and thunderstorms across the Central Valley. Lightning and small hail were reported with these storms, along with a gustnado spotted near Wheatland. A woman was struck by lightning in her home near Marysville.",206
227229,FRESNO CO.,HAMMOND,04/12/2010,1500,Lightning, , ,0,0,200000,0,CA,PST-8, ,39136,C,19,HNX,0,0,Broadcast Media, , , ,1,NW,1,NW,HAMMOND,04/12/2010,1500,36.78,-119.79,36.78,-119.79,"Lightning struck a condominium building on Van Ness Avenue just north of Shaw Avenue in Fresno. Two units were destroyed. Damage was estimated between 100,000 to 200,000 dollars.","Skies cleared out on April 6th, except for some upslope mountain clouds, as the trough moved east and an eastern Pacific ridge began to build into California. Interior central California experienced tranquil weather for the next several days, but a potent late-season storm was dropping out of the Gulf of Alaska.||The storm moved into central California on April 11th. This was a much wetter storm than that of the week before, and the two-day rainfall totals for several central and southern San Joaquin Valley sites were close to, or over, the normal rainfall for the entire month of April. Gusty winds developed over the San Joaquin Valley during the afternoon of the 11th as the cold front pushed through. Winds gusted to 56 mph at Avenal on the west side of the Valley, while gusts to 46 mph were measured at Meadows Field in Bakersfield. An aircraft taking off from the Taft Municipal Airport was caught in one of these gusts. The aircraft was flipped over and crashed. The pilot only suffered minor injuries, but the aircraft had serious damage.||Thunderstorms developed over the central and southern San Joaquin Valley during the afternoon and early evening of April 12th, with hail up to three quarters of an inch in diameter. Lightning struck a condominium building in Fresno during the late afternoon, starting a fire that destroyed two units.||Another 12 to 18 inches of snow fell on the Southern Sierra Nevada, with both Lodgepole and Grant Grove reporting 15 inches. In the Tehachapi Mountains, up to 6 inches of new snow fell at Pine Mountain Club, and 4 inches at Cuddy Valley.||With abundant ground moisture from the rains, patchy dense fog developed during the early morning of April 13th. Isolated patches of fog formed the next morning, mainly in Merced County; otherwise the central and south Valley remained fog free as a drier airmass moved into the region. An upper-level ridge brought mostly clear skies and near- to slightly-above normal temperatures to interior central California through the 19th.",207
249706,RIVERSIDE CO.,DESERT CENTER,07/15/2010,1400,Lightning, , ,0,0,5000,0,CA,PST-8, ,42747,C,65,PSR,0,0,Park/Forest Service, , , ,20,W,19,N,CACTUS CITY,07/15/2010,1600,33.72,-115.748,33.9479,-115.9937,"Lightning ignited several trees and started a 10 acre fire.","Slow moving storms dropped very heavy rains over parts of Joshua Tree National Park.",208
258205,RIVERSIDE CO.,DESERT HOT SPGS,08/26/2010,1430,Lightning, , ,0,0,2000,0,CA,PST-8, ,44493,C,65,PSR,0,0,Park/Forest Service, , , ,15,ENE,15,ENE,DESERT HOT SPGS,08/26/2010,1430,34.03,-116.25,34.03,-116.25,"The Chief Ranger at JTNP reported lightning started a brush fire that burned for two days and consumed about 110 acres in the Keys View area.","Afternoon thunderstorms and frequent lightning ignited fires in Joshua Tree NP.",209
250703,SAN BERNARDINO CO.,BARSTOW,08/26/2010,1500,Lightning, , ,0,0,2000,0,CA,PST-8, ,43003,C,71,VEF,0,0,Fire Department/Rescue, , , ,1,NNW,1,NNW,BARSTOW,08/26/2010,1500,34.8944,-117.041,34.8944,-117.041,"Lightning struck a house.","Monsoon moisture fueled several rounds of thunderstorms over the Mojave Desert, with the greatest coverage of storms on the 26th and 27th.  Several storms produced severe weather and flash flooding.",210
264252,SAN BERNARDINO CO.,FONTANA,10/01/2010,840,Lightning, , ,0,1,0,0,CA,PST-8, ,45514,C,71,SGX,0,0,Fire Department/Rescue, , , ,0,N,0,N,FONTANA,10/01/2010,845,34.1,-117.43,34.1,-117.43,"A construction worker suffered minor burns when lightning struck a nearby crane at the Kaiser Permanente Fontana Medical Center at 0842 PST on October 1. The 50-year old man was thrown to the ground as a result of the strike. His injuries are non-life-threatening.","Low pressure moving northeast from the west coast of Baja brought moist, unstable air into southern California, setting off several rounds of showers and thunderstorms between October 1-2. Storms were primarily concentrated in the mountain and desert areas with mostly light rainfall, but a few intense thunderstorms with higher totals.",211
264223,RIVERSIDE CO.,WILDOMAR,10/19/2010,640,Lightning, , ,0,0,8000,0,CA,PST-8, ,45511,C,65,SGX,0,0,Fire Department/Rescue, , , ,4,SW,4,SW,WILDOMAR,10/19/2010,650,33.556,-117.3365,33.556,-117.3365,"A two-story home was struck by lightning during a thunderstorm, creating a 6-inch hole in the roof. No fire or injuries.","A cutoff low pressure system moved inland just south of the International Border bringing numerous showers and isolated thunderstorms to the region. Rainfall was widespread and generous in amount, causing numerous reports of urban flooding.",212
264253,SAN BERNARDINO CO.,HESPERIA,10/19/2010,800,Lightning, , ,0,0,15000,0,CA,PST-8, ,45511,C,71,SGX,0,0,Fire Department/Rescue, , , ,2,SE,2,SE,HESPERIA,10/19/2010,815,34.3987,-117.2811,34.3987,-117.2811,"Lightning struck a trailer located in the 18000 block of Danbury Avenue around 0800 PST on October 19, setting it on fire. No injuries were reported.","A cutoff low pressure system moved inland just south of the International Border bringing numerous showers and isolated thunderstorms to the region. Rainfall was widespread and generous in amount, causing numerous reports of urban flooding.",213
264222,RIVERSIDE CO.,WOODCREST,10/19/2010,1650,Lightning, , ,0,0,6000,0,CA,PST-8, ,45511,C,65,SGX,0,0,Fire Department/Rescue, , , ,1,SSE,1,SSE,WOODCREST,10/19/2010,1700,33.8695,-117.3429,33.8695,-117.3429,"A single family residence received a direct lightning strike to the roof, creating a 3-inch diameter hole. No injuries or fire, but the American Red Cross was called to assist the 5 adults and one infant residents.","A cutoff low pressure system moved inland just south of the International Border bringing numerous showers and isolated thunderstorms to the region. Rainfall was widespread and generous in amount, causing numerous reports of urban flooding.",214
322834,SAN BERNARDINO CO.,TWENTY NINE PALMS,07/07/2011,1354,Lightning, , ,0,0,25000,0,CA,PST-8, ,52141,C,71,VEF,0,0,Newspaper, , , ,4,WNW,4,WNW,TWENTY NINE PALMS,07/07/2011,1354,34.1496,-116.107,34.1496,-116.107,"Lightning knocked down numerous power poles on Two Mile Road at Sunrise Road.","Monsoon moisture lingered over the Mojave Desert and southern Great Basin, continuing to fuel thunderstorms.  Some storms produced severe weather and flash flooding.",215
322852,SAN BERNARDINO CO.,(NXP)MCAF TWENTYNINE,07/31/2011,100,Lightning, , ,0,0,10000,0,CA,PST-8, ,53891,C,71,VEF,0,0,Newspaper, , , ,3,NW,3,NW,(NXP)MCAF TWENTYNINE,07/31/2011,100,34.1654,-115.9926,34.1654,-115.9926,"Lightning struck a power pole, knocking power out for eight hours in the neighborhood.","Another push of monsoon moisture fueled more thunderstorms across the Mojave Desert and southern Great Basin. Several storms produced flash flooding, and there was also isolated severe weather.",216
338804,FRESNO CO.,SANGER,07/31/2011,830,Lightning, , ,0,1,3500,0,CA,PST-8, ,56492,C,19,HNX,0,0,Broadcast Media, , , ,1,E,1,E,SANGER,07/31/2011,830,36.7,-119.55,36.7,-119.55,"A 21- Year old woman was struck in the ankle while inside her home by lightning. She was standing near a sliding glass door.","On the 28th, southeast winds aloft began to bring mid-level moisture from northern Mexico and the Desert Southwest. For the first time in approximately three weeks, isolated thunderstorms developed over the Sierra crest around Kings Canyon and points just to the north and east. The surge of monsoonal moisture continued through the end of the month, with the strongest thunderstorm activity on July 30th and the morning of the 31st. A few thunderstorms over the Southern Sierra Nevada had rain rates of an inch or more in an hour, and a severe thunderstorm moved over Edwards Air Force Base during the afternoon of the 30th. The warm nature of the monsoonal moisture kept central and southern San Joaquin Valley high temperatures around 100 degrees through July 30th. ||A line of thunderstorms moved through the central and southern San Joaquin Valley during the morning of July 31st, bringing record-tying rain to both Bakersfield and Fresno. After the thunderstorms moved out of the San Joaquin Valley, skies began to clear and temperatures warmed rapidly. With the cloud cover, the temperature at Fresno was between 70-72 degrees for most of the morning of the 31st. But once the clouds began to clear, the temperature warmed at a rate of 8 degrees per hour from 11 AM to 1 PM (reaching 88 degrees), and topped out at 97 degrees at 5 PM.|Both Bakersfield and Fresno were 0.6 degrees warmer than normal for July. However, July was the last month to use the 1971-2000 30-year climatological normals. The new normals, for 1981-2010, were implemented of August 1st. The new average temperature for July is slightly warmer than the 1971-2000 average. Using the new normals, July 2011 was slightly cooler than normal, with Bakersfield down 0.1 degree, and Fresno down 1.0 degree. Both Bakersfield and Fresno had 11 days with highs of 100 or above in July.",217
323469,SAN BERNARDINO CO.,NEEDLES,08/01/2011,1755,Lightning, , ,0,0,50000,0,CA,PST-8, ,53899,C,71,VEF,0,0,Newspaper, , , ,0,N,0,N,NEEDLES,08/01/2011,1805,34.83,-114.6,34.83,-114.6,"Lightning knocked out phone service and electric service to a fire station and a newspaper office in Needles.  Computer equipment was also destroyed at the newspaper office and at a food service business.","The last remnants of the monsoon moisture push that began in late July fueled thunderstorms which produced isolated severe weather and flash flooding over southeast California.",218
334019,SAN BERNARDINO CO.,TWENTY NINE PALMS,08/27/2011,1220,Lightning, , ,0,0,50000,0,CA,PST-8, ,55136,C,71,VEF,0,0,Newspaper, , , ,3,N,6,N,TWENTY NINE PALMS,08/27/2011,1451,34.1663,-116.0542,34.2186,-116.052,"Lightning struck a total of seven power poles, knocking out power to 2700 customers.","Monsoon moisture and high temperatures fueled thunderstorms over the Mojave Desert.  Several storms produced severe weather and flash flooding.",219
334071,SAN BERNARDINO CO.,CALICO,09/09/2011,2301,Lightning, , ,0,0,5000,0,CA,PST-8, ,55712,C,71,VEF,0,0,Law Enforcement, , , ,4,SSW,4,SSW,CALICO,09/09/2011,2301,34.903,-116.9073,34.903,-116.9073,"Lightning struck and set afire a power pole.","Monsoon moisture and an upper level low fueled thunderstorms over the Mojave Desert.  Several storms produced severe weather and flash flooding.",220
350024,KERN CO.,RIDGECREST,09/10/2011,2115,Lightning, , ,0,1,0,0,CA,PST-8, ,58364,C,29,HNX,0,0,Law Enforcement, , , ,0,N,0,N,RIDGECREST,09/10/2011,2115,35.63,-117.68,35.63,-117.68,"A resident of Ridgecrest was struck by lightning and injured.","A dry southwest flow aloft set up over the area on the 6th along the leading edge of a upper level trough over the Pacific Northwest and northern California, bringing dry weather through the 8th. However, an upper level low moved from the Great Basin into central California on the 9th. This atypical movement of the low occurred because it was cut off from the prevailing westerly winds aloft. These systems usually move into the area from the Pacific Ocean. This low changed the flow aloft over the region to southeasterly, drawing moisture into central California from Arizona and northwestern Mexico. This warm, unstable airmass brought showers and thunderstorms to much of interior central California from the 9th through the 14th. Isolated thunderstorms continued over the Sierra Nevada crest on the 15th, as residual moisture remained over the area while the southeasterly flow transitioned to a more southwesterly direction. ||The low meandered across central and southern California during these several days. This low allowed for unstable conditions over the entire district; quite a few locations in the San Joaquin Valley received at least a trace of rain. On the 9th, thunderstorms produced little rainfall, but they did cause quite a few wildfires due to lightning over the mountains in Kern County (around Keene, Breckenridge, and just to the east of Arvin and Bakersfield). As for the 10th, numerous thunderstorms developed over Kern County and much of the southern San Joaquin Valley during the evening. In addition, more wildfires developed over the Kern County mountains A severe thunderstorm warning and numerous significant weather advisories were issued throughout Kern County that evening; these storms moved westward into San Luis Obispo County later that night. Afternoon showers and thunderstorms redeveloped mainly over the Tehachapi Mountains and the Southern Sierra Nevada daily on the 11th, 12th, and 13th, and a few showers occurred over the south end of the San Joaquin Valley, including Bakersfield, on the 13th. Thunderstorms that developed over the Piutes during the afternoon of September 11th were nearly stationary, and runoff from these storms caused road flooding in the area south of Lake Isabella. ||The South Lightning Tennessee Fire occurred in Tulare county 5 miles north of Fountain Springs. Reports indicated that the fire began on 9/11/11 at 1200 PDT due to heavy lightning strikes from thunderstorms. ||The Tamarack wildfire occurred just northeast of Yosemite Valley in Mariposa County on 9/13/11 at 1912 PDT. This wildfire was caused by extensive lightning. The size was 480 acres. The fire was contained on 10/6/11. There were no lost fatalities or structures. Cost to containment was $75,000. ||The Breckenridge wildfire Complex occurred in the Kern County Mountains, 10 miles NE of Bakersfield. The fire started on the 10th and was contained on the 17th, and caused by lightning strikes. The size was a whopping 25,213 acres. There were no fatalities or structures lost. The cost to containment was $7.1 million. ||The Comanche wildfire Complex in Kern County mountains occurred on 9/10/11 at  0400 PDT, about 8 miles Southeast of Arvin, caused by lightning. The size was a whopping 29,338 acres. Containment was reached on 9/16/11. There were no fatalities or lost structures. The cost to containment was $6.8 million. ||The Keene wildfire Complex occurred because on lightning on 9/10/11 at 1200 PDT. The location was along the Highway 58 corridor from Keene to Mojave in Kern County. The size was 10,479 acres. Containment was reached on 9/15/11. There were no fatalities or Structures Lost. The cost to containment was $8,839,174.",221
350026,KERN CO.,RIDGECREST,09/10/2011,2115,Lightning, , ,0,1,0,0,CA,PST-8, ,58364,C,29,HNX,0,0,Law Enforcement, , , ,1,E,1,E,RIDGECREST,09/10/2011,2115,35.63,-117.66,35.63,-117.66,"Another resident of Ridgecrest was injured by a lightning strike from a thunderstorm.","A dry southwest flow aloft set up over the area on the 6th along the leading edge of a upper level trough over the Pacific Northwest and northern California, bringing dry weather through the 8th. However, an upper level low moved from the Great Basin into central California on the 9th. This atypical movement of the low occurred because it was cut off from the prevailing westerly winds aloft. These systems usually move into the area from the Pacific Ocean. This low changed the flow aloft over the region to southeasterly, drawing moisture into central California from Arizona and northwestern Mexico. This warm, unstable airmass brought showers and thunderstorms to much of interior central California from the 9th through the 14th. Isolated thunderstorms continued over the Sierra Nevada crest on the 15th, as residual moisture remained over the area while the southeasterly flow transitioned to a more southwesterly direction. ||The low meandered across central and southern California during these several days. This low allowed for unstable conditions over the entire district; quite a few locations in the San Joaquin Valley received at least a trace of rain. On the 9th, thunderstorms produced little rainfall, but they did cause quite a few wildfires due to lightning over the mountains in Kern County (around Keene, Breckenridge, and just to the east of Arvin and Bakersfield). As for the 10th, numerous thunderstorms developed over Kern County and much of the southern San Joaquin Valley during the evening. In addition, more wildfires developed over the Kern County mountains A severe thunderstorm warning and numerous significant weather advisories were issued throughout Kern County that evening; these storms moved westward into San Luis Obispo County later that night. Afternoon showers and thunderstorms redeveloped mainly over the Tehachapi Mountains and the Southern Sierra Nevada daily on the 11th, 12th, and 13th, and a few showers occurred over the south end of the San Joaquin Valley, including Bakersfield, on the 13th. Thunderstorms that developed over the Piutes during the afternoon of September 11th were nearly stationary, and runoff from these storms caused road flooding in the area south of Lake Isabella. ||The South Lightning Tennessee Fire occurred in Tulare county 5 miles north of Fountain Springs. Reports indicated that the fire began on 9/11/11 at 1200 PDT due to heavy lightning strikes from thunderstorms. ||The Tamarack wildfire occurred just northeast of Yosemite Valley in Mariposa County on 9/13/11 at 1912 PDT. This wildfire was caused by extensive lightning. The size was 480 acres. The fire was contained on 10/6/11. There were no lost fatalities or structures. Cost to containment was $75,000. ||The Breckenridge wildfire Complex occurred in the Kern County Mountains, 10 miles NE of Bakersfield. The fire started on the 10th and was contained on the 17th, and caused by lightning strikes. The size was a whopping 25,213 acres. There were no fatalities or structures lost. The cost to containment was $7.1 million. ||The Comanche wildfire Complex in Kern County mountains occurred on 9/10/11 at  0400 PDT, about 8 miles Southeast of Arvin, caused by lightning. The size was a whopping 29,338 acres. Containment was reached on 9/16/11. There were no fatalities or lost structures. The cost to containment was $6.8 million. ||The Keene wildfire Complex occurred because on lightning on 9/10/11 at 1200 PDT. The location was along the Highway 58 corridor from Keene to Mojave in Kern County. The size was 10,479 acres. Containment was reached on 9/15/11. There were no fatalities or Structures Lost. The cost to containment was $8,839,174.",222
334121,SAN BERNARDINO CO.,JOSHUA TREE ARPT,09/13/2011,800,Lightning, , ,0,0,10000,0,CA,PST-8, ,55719,C,71,VEF,0,0,Newspaper, , , ,4,ESE,4,ESE,JOSHUA TREE ARPT,09/13/2011,800,34.1348,-116.181,34.1348,-116.181,"Lightning struck a power line at Highway 62 and Dorth Place.","A slow moving upper level low and monsoon moisture fueled thunderstorms over the Mojave Desert.  Many storms produced flash flooding and severe weather.",223
347325,VENTURA CO.,WHEELER SPGS,09/13/2011,1415,Lightning, , ,0,3,0,0,CA,PST-8, ,57901,C,111,LOX,0,0,Fire Department/Rescue, , , ,20,NNE,20,NNE,WHEELER SPGS,09/13/2011,1415,34.75,-119.12,34.75,-119.12,"At the Lockwood Valley Fire Station, three firefighters were injured when lightning struck within 50 feet of the station. All three firefighters reported disorientation and ringing in the ears.","An unseasonable upper level low pressure system moved onshore across the area. Instability associated with this low pressure system generated strong thunderstorms over the mountains of Southern California. These thunderstorms produced heavy rainfall and flash flooding across mountain roadways.",224
